{
  "specVersion": "1.0",
  "method": {
    "name": "createEscalatorBetweenLevel",
    "intent": "Create an escalator between Level 1 and Level 2 in the lobby area",
    "tier": 3,
    "category": "capability"
  },
  "inputs": {},
  "preconditions": [
    "Active document exists"
  ],
  "algorithm": [
    "TODO: Implement Create an escalator between Level 1 and Level 2 in the lobby area"
  ],
  "validation": {
    "successCriteria": "Method completes successfully",
    "evidence": [
      "success",
      "message"
    ]
  },
  "metadata": {
    "proposedBy": "Claude (auto-generated)",
    "proposedAt": "2025-12-26T14:17:33.0068686-08:00",
    "triggeringTask": "Create an escalator between Level 1 and Level 2 in the lobby area",
    "autoGenerated": true
  }
}