{
  "specVersion": "1.0",
  "method": {
    "name": "createStaircaseWithCustom",
    "intent": "Create a staircase with custom riser height",
    "tier": 3,
    "category": "capability"
  },
  "inputs": {},
  "preconditions": [
    "Active document exists"
  ],
  "algorithm": [
    "TODO: Implement Create a staircase with custom riser height"
  ],
  "validation": {
    "successCriteria": "Method completes successfully",
    "evidence": [
      "success",
      "message"
    ]
  },
  "metadata": {
    "proposedBy": "Claude (auto-generated)",
    "proposedAt": "2025-12-26T13:56:08.8564654-08:00",
    "triggeringTask": "Create a staircase with custom riser height",
    "autoGenerated": true
  }
}